{
  "schema_version": "1.0",
  "submission_id": "drivaerml-transformer",
  "dataset_id": "drivaerml",
  "split_id": "rear_separation",
  "reference_version": "drivaerml-evaluator-v3-candidate",
  "code_revision": "drivaerml-realistic-prototype-profiles-v1",
  "generated_at": "2026-08-21T00:00:00Z",
  "status": "prototype_dummy_data",
  "metric_values": {
    "overall_score": 0.0,
    "field_score": 0.0,
    "force_score": 0.0,
    "diagnostic_score": 0.0,
    "surface_pressure_rel_l2": 4.35,
    "surface_pressure_equal_entity_rel_l2": 4.437,
    "surface_wall_shear_rel_l2": 8.26,
    "surface_wall_shear_equal_entity_rel_l2": 8.4252,
    "volume_velocity_rel_l2": 6.21,
    "volume_pressure_rel_l2": 6.27,
    "drivaerml_surface_pressure_area_mae": 26.6,
    "drivaerml_surface_pressure_area_rmse": 37.0,
    "drivaerml_surface_pressure_equal_entity_mae": 27.132,
    "drivaerml_surface_pressure_equal_entity_rmse": 37.74,
    "drivaerml_surface_wall_shear_area_mae": 0.84,
    "drivaerml_surface_wall_shear_area_rmse": 1.24,
    "drivaerml_surface_wall_shear_equal_entity_mae": 0.8568,
    "drivaerml_surface_wall_shear_equal_entity_rmse": 1.2648,
    "drivaerml_volume_velocity_equal_entity_mae": 1.96,
    "drivaerml_volume_velocity_equal_entity_rmse": 2.79,
    "drivaerml_volume_pressure_equal_entity_mae": 32.4,
    "drivaerml_volume_pressure_equal_entity_rmse": 47.0,
    "field_integrated_cd_rmse": 0.0031,
    "field_integrated_cl_rmse": 0.0076,
    "field_integrated_cmpitch_rmse": 0.0057,
    "field_integrated_clf_rmse": 0.00608,
    "field_integrated_clr_rmse": 0.00608,
    "field_integrated_lift_closure_max_abs": 1e-07,
    "velocity_profile_uinf_rmse": 0.07638721486,
    "velocity_profile_experimental_subset_uinf_rmse": 0.078324066444,
    "cp_cut_rmse": 0.049908938999
  },
  "profile_index_sha256": "d63bb5d2b70a386fed7d39414493bf4b0a3406e45ca165672495a7efd4c46394",
  "notes": "Deterministic analytical teaching fixture for the closed DrivAerML candidate. It contains smooth CFD-like predictions on all four continuous Cp-cut supports and the exact 3,756-point AutoCFD5 velocity grid for every official test case. The dimensional field errors retain the prototype calibration and the profile errors are recomputed from the generated curves. It is not a native-field evaluation, approved result, ranking entry, or citable model claim. The four score values remain zero because the nine physics-null denominators are not published.",
  "command": "python3 scripts/generate_drivaerml_leaderboard_fixtures.py"
}
