{
  "schema_version": "1.0",
  "submission_id": "transformer",
  "dataset_id": "ahmedml",
  "split_id": "image_wake",
  "reference_version": "prototype-1",
  "code_revision": "prototype-dummy-data",
  "generated_at": "2025-06-13T00:00:00Z",
  "status": "prototype_dummy_data",
  "metric_values": {
    "surface_pressure_rel_l2": 3.41,
    "surface_pressure_rel_l1": 2.455,
    "surface_wall_shear_rel_l2": 4.03,
    "surface_wall_shear_rel_l1": 2.74,
    "volume_velocity_rel_l2": 2.09,
    "volume_velocity_rel_l1": 1.463,
    "volume_pressure_rel_l2": 2.16,
    "volume_pressure_rel_l1": 1.49,
    "cd_r2": 0.985,
    "cl_r2": 0.971,
    "velocity_profile_r2": 0.969,
    "cp_cut_r2": 0.961,
    "surface_pressure_mae": 17.2,
    "surface_pressure_rmse": 23.9,
    "surface_wall_shear_mae": 0.33,
    "surface_wall_shear_rmse": 0.48,
    "volume_velocity_mae": 0.59,
    "volume_velocity_rmse": 0.84,
    "volume_pressure_mae": 8.9,
    "volume_pressure_rmse": 13,
    "c_drag_mae": 0.002,
    "c_lift_mae": 0.0054,
    "field_score": 81.045,
    "force_score": 97.94,
    "diagnostic_score": 96.58,
    "overall_score": 89.15249999999999,
    "surface_pressure_equal_entity_rel_l2": 3.5464,
    "surface_wall_shear_equal_entity_rel_l2": 4.1912,
    "volume_velocity_physical_rel_l2": 2.009615,
    "volume_pressure_physical_rel_l2": 2.076923
  },
  "profile_index_sha256": "d39d4249f307d8fce64508e51cbd326b58d47caefbf71fc3cd4d6e4c452429ea",
  "notes": "Illustrative evidence metadata for dummy-data pipeline testing; not a scientific evaluation record. Prototype dual-weight values are illustrative policy fixtures, not recomputations from public fields.",
  "command": "not-applicable (illustrative dummy data)"
}
