{
  "schema_version": "1.0",
  "submission_id": "rotor37-prototype-train-16",
  "dataset_id": "rotor37",
  "split_id": "train_16",
  "reference_version": "prototype-1",
  "code_revision": "prototype-dummy-data",
  "generated_at": "2026-07-15T00:00:00Z",
  "status": "prototype_dummy_data",
  "metric_values": {
    "overall_score": 92.99533333333332,
    "rotor_density_rrmse": 0.07189,
    "rotor_density_rel_l2": 7.575,
    "rotor_density_rel_l1": 5.33,
    "rotor_density_r2": 0.9256,
    "rotor_density_mae": 0.0332,
    "rotor_density_rmse": 0.0458,
    "rotor_pressure_rrmse": 0.08848,
    "rotor_pressure_rel_l2": 9.351,
    "rotor_pressure_rel_l1": 6.609,
    "rotor_pressure_r2": 0.9016,
    "rotor_pressure_mae": 3318,
    "rotor_pressure_rmse": 4819,
    "rotor_temperature_rrmse": 0.06162,
    "rotor_temperature_rel_l2": 6.481,
    "rotor_temperature_rel_l1": 4.547,
    "rotor_temperature_r2": 0.9396,
    "rotor_temperature_mae": 5.056,
    "rotor_temperature_rmse": 7.189,
    "rotor_massflow_rrmse": 0.05688,
    "rotor_massflow_rel_l2": 5.977,
    "rotor_massflow_rel_l1": 4.189,
    "rotor_massflow_r2": 0.9458,
    "rotor_massflow_mae": 0.6478,
    "rotor_massflow_rmse": 0.9006,
    "rotor_compression_ratio_rrmse": 0.06557,
    "rotor_compression_ratio_rel_l2": 6.901,
    "rotor_compression_ratio_rel_l1": 4.848,
    "rotor_compression_ratio_r2": 0.9343,
    "rotor_compression_ratio_mae": 0.0245,
    "rotor_compression_ratio_rmse": 0.0348,
    "rotor_efficiency_rrmse": 0.07584,
    "rotor_efficiency_rel_l2": 7.997,
    "rotor_efficiency_rel_l1": 5.633,
    "rotor_efficiency_r2": 0.92,
    "rotor_efficiency_mae": 0.015,
    "rotor_efficiency_rmse": 0.0213,
    "total_error": 0.07005,
    "rotor_density_area_rel_l2": 7.809278,
    "rotor_pressure_area_rel_l2": 9.640206,
    "rotor_temperature_area_rel_l2": 6.681443
  },
  "profile_index_sha256": "287098d991721ef2d099daca54ac59908766e0294f1e73b92987891d34f3fc4e",
  "notes": "Illustrative evidence metadata for dummy-data pipeline testing; not a scientific evaluation record. Prototype dual-weight values are illustrative policy fixtures, not recomputations from public fields.",
  "command": "not-applicable (illustrative dummy data)"
}
