{
  "schema_version": "1.0",
  "submission_id": "lno",
  "dataset_id": "ahmedml",
  "split_id": "geometry",
  "reference_version": "prototype-1",
  "code_revision": "prototype-dummy-data",
  "generated_at": "2025-06-13T00:00:00Z",
  "status": "prototype_dummy_data",
  "metric_values": {
    "surface_pressure_rel_l2": 12.91,
    "surface_pressure_rel_l1": 9.295,
    "surface_wall_shear_rel_l2": 11.44,
    "surface_wall_shear_rel_l1": 7.779,
    "volume_velocity_rel_l2": 7.56,
    "volume_velocity_rel_l1": 5.292,
    "volume_pressure_rel_l2": 8.47,
    "volume_pressure_rel_l1": 5.844,
    "cd_r2": 0.829,
    "cl_r2": 0.792,
    "velocity_profile_r2": 0.778,
    "cp_cut_r2": 0.764,
    "surface_pressure_mae": 65.1,
    "surface_pressure_rmse": 90.4,
    "surface_wall_shear_mae": 0.93,
    "surface_wall_shear_rmse": 1.37,
    "volume_velocity_mae": 2.12,
    "volume_velocity_rmse": 3.02,
    "volume_pressure_mae": 35.1,
    "volume_pressure_rmse": 50.8,
    "c_drag_mae": 0.0212,
    "c_lift_mae": 0.0377,
    "field_score": 32.54666666666667,
    "force_score": 81.42,
    "diagnostic_score": 77.24000000000001,
    "overall_score": 55.93833333333333
  },
  "profile_index_sha256": "56753e30374dc103ee3e49dd75dea8d5574ee41f9e84996f847738e3a4d7b014",
  "notes": "Illustrative evidence metadata for dummy-data pipeline testing; not a scientific evaluation record.",
  "command": "not-applicable (illustrative dummy data)"
}
