{
  "schema_version": "1.0",
  "submission_id": "drivaerml-transolver",
  "dataset_id": "drivaerml",
  "split_id": "full",
  "reference_version": "drivaerml-evaluator-v3-candidate",
  "code_revision": "prototype-dummy-data",
  "generated_at": "2025-06-13T00:00:00Z",
  "status": "prototype_dummy_data",
  "metric_values": {
    "overall_score": 0.0,
    "field_score": 0.0,
    "force_score": 0.0,
    "diagnostic_score": 0.0,
    "surface_pressure_rel_l2": 4.81,
    "surface_pressure_equal_entity_rel_l2": 5.0024,
    "surface_wall_shear_rel_l2": 8.95,
    "surface_wall_shear_equal_entity_rel_l2": 9.308,
    "volume_velocity_rel_l2": 6.78,
    "volume_pressure_rel_l2": 7.74,
    "drivaerml_surface_pressure_area_mae": 29.4,
    "drivaerml_surface_pressure_area_rmse": 40.9,
    "drivaerml_surface_pressure_equal_entity_mae": 29.4,
    "drivaerml_surface_pressure_equal_entity_rmse": 40.9,
    "drivaerml_surface_wall_shear_area_mae": 0.91,
    "drivaerml_surface_wall_shear_area_rmse": 1.34,
    "drivaerml_surface_wall_shear_equal_entity_mae": 0.91,
    "drivaerml_surface_wall_shear_equal_entity_rmse": 1.34,
    "drivaerml_volume_velocity_equal_entity_mae": 2.14,
    "drivaerml_volume_velocity_equal_entity_rmse": 3.05,
    "drivaerml_volume_pressure_equal_entity_mae": 40.1,
    "drivaerml_volume_pressure_equal_entity_rmse": 58.0,
    "field_integrated_cd_rmse": 0.0039,
    "field_integrated_cl_rmse": 0.0087,
    "field_integrated_cmpitch_rmse": 0.0065249999999999996,
    "field_integrated_clf_rmse": 0.00696,
    "field_integrated_clr_rmse": 0.00696,
    "field_integrated_lift_closure_max_abs": 1e-07,
    "velocity_profile_uinf_rmse": 0.25495097567963915,
    "velocity_profile_experimental_subset_uinf_rmse": 0.25495097567963915,
    "cp_cut_rmse": 0.25
  },
  "profile_index_sha256": "2305a6bd94f26753e730a3d58c1331b6f49d26dfdafad65edf978e1bce7f472a",
  "notes": "Structural dummy evidence for the closed DrivAerML candidate; not computed from public fields and not scientifically rankable.",
  "command": "not-applicable (illustrative dummy data)"
}
