{
  "schema_version": "1.0",
  "submission_id": "airfrans-mlp-full",
  "dataset_id": "airfrans",
  "split_id": "aoa_extrapolation",
  "reference_version": "airfrans-scoring-v2-candidate",
  "code_revision": "prototype-dummy-data",
  "generated_at": "2023-06-01T00:00:00Z",
  "status": "prototype_dummy_data",
  "metric_values": {
    "overall_score": 61.67166666666667,
    "surface_pressure_rel_l2": 33.62,
    "surface_pressure_rel_l1": 24.206,
    "surface_wall_shear_rel_l2": 4.29,
    "surface_wall_shear_rel_l1": 2.917,
    "flow_domain_velocity_rel_l2": 9.82,
    "flow_domain_velocity_rel_l1": 6.874,
    "flow_domain_pressure_rel_l2": 8.6,
    "flow_domain_pressure_rel_l1": 5.934,
    "cd_r2": 0.957,
    "cl_r2": 0.992,
    "velocity_profile_r2": 0.902,
    "c_drag_mae": 0.0058,
    "c_lift_mae": 0.0017,
    "field_score": 29.693333333333335,
    "force_score": 97.10000000000001,
    "diagnostic_score": 90.2,
    "surface_pressure_equal_entity_rel_l2": 31.939,
    "surface_wall_shear_equal_entity_rel_l2": 4.0755,
    "flow_domain_velocity_physical_rel_l2": 10.336842,
    "flow_domain_pressure_physical_rel_l2": 9.052632
  },
  "profile_index_sha256": "741e3d20b4de92ea4694b3faa59934f22c6394c4997028b2f4b4155db63d655f",
  "notes": "Illustrative evidence metadata for dummy-data pipeline testing; not a scientific evaluation record. Prototype dual-weight values are illustrative policy fixtures, not recomputations from public fields.",
  "command": "not-applicable (illustrative dummy data)"
}
